[
  {
    "blueprint_id": "nvidia_vss_video_summarization",
    "name": "NVIDIA VSS Video Summarization Workflow",
    "vendor": "nvidia",
    "source": "docs_blueprint",
    "category": "video_understanding",
    "short_description": "Long-video summarization and event extraction pipeline with VIOS, VLM and LLM orchestration.",
    "supports_large_server_deployment": true,
    "reference_deployments": [
      {
        "deployment_id": "vss_health_eval_h100_pcie",
        "hardware_label": "8x NVIDIA H100 PCIe (example profiling run)",
        "hardware_class": "8gpu_server",
        "gpu_topology": "8x PCIe GPUs; example split 4x LLM + 4x shared VLM/embedding/reranker from older VSS performance docs",
        "workload_input": {
          "video_duration_seconds": 180,
          "chunk_size_seconds": 30,
          "num_chunks": 6,
          "mode": "summarization"
        },
        "performance": {
          "e2e_latency_seconds_example": 20.33,
          "vlm_pipeline_latency_seconds_example": 10.46,
          "context_rag_latency_seconds_example": 9.29,
          "decode_latency_seconds_example": 8.94,
          "vlm_latency_seconds_example": 8.42
        },
        "notes": "Numbers are from VSS health-eval example metrics and should be treated as a calibration baseline, not a universal promise."
      }
    ],
    "pipeline_roles": [
      {
        "role_id": "video_io_role",
        "role_type": "video_io_storage",
        "replaceable": false,
        "default_model_reference": "VIOS",
        "allowed_model_kinds": [
          "service"
        ],
        "language_sensitive": false,
        "notes": "Video ingestion and storage layer."
      },
      {
        "role_id": "vlm_role",
        "role_type": "vision_language_model",
        "replaceable": true,
        "default_model_reference": "default VLM in VSS deployment",
        "allowed_model_kinds": [
          "huggingface_vlm",
          "nim_vlm",
          "api_vlm"
        ],
        "language_sensitive": true,
        "notes": "Can be replaced if the substitute supports chunked long-video interpretation."
      },
      {
        "role_id": "llm_role",
        "role_type": "language_model",
        "replaceable": true,
        "default_model_reference": "Nemotron LLM (NIM)",
        "allowed_model_kinds": [
          "huggingface_llm",
          "nim_llm",
          "api_llm"
        ],
        "language_sensitive": true,
        "notes": "Primary reasoning and summary generation role; Hungarian-friendly models should be allowed here."
      },
      {
        "role_id": "retrieval_role",
        "role_type": "context_rag",
        "replaceable": true,
        "default_model_reference": "Context-aware RAG stack",
        "allowed_model_kinds": [
          "rag_stack",
          "embedding_model",
          "reranker_model"
        ],
        "language_sensitive": true,
        "notes": "May be disabled or swapped depending on workflow."
      }
    ],
    "supports_model_substitution": true,
    "substitution_policy": {
      "role_based": true,
      "hf_supported": true,
      "language_override_supported": true,
      "required_capabilities_by_role": {
        "vlm_role": [
          "video_or_frame_reasoning",
          "sufficient_context_window_or_chunking"
        ],
        "llm_role": [
          "tool_orchestrated_summary",
          "multilingual_or_target_language_support"
        ],
        "retrieval_role": [
          "embedding_compatibility",
          "reranking_if_enabled"
        ]
      },
      "risk_notes": [
        "Changing VLM can shift token volume and chunk latency significantly.",
        "Changing LLM affects summary quality, latency and language coverage.",
        "For Hungarian output, replace the default LLM with a Hungarian-capable model or an LLM known to handle Hungarian well."
      ]
    },
    "simulation_tags": [
      "24x7",
      "batchable",
      "long_video",
      "multimodal",
      "agentic_optional"
    ],
    "known_limitations": [
      "Shared GPU mode validation is limited on some GPUs and model combinations.",
      "Chunk size and video duration heavily affect latency and token usage."
    ],
    "source_urls": [
      "https://docs.nvidia.com/vss/3.1.0/agent-workflow-lvs.html",
      "https://docs.nvidia.com/vss/2.4.0/content/vss_observability.html",
      "https://docs.nvidia.com/vss/2.4.1/content/optimal_topology.html",
      "https://docs.nvidia.com/vss/3.1.0/prerequisites.html",
      "https://build.nvidia.com/nvidia/video-search-and-summarization/blueprintcard"
    ]
  },
  {
    "blueprint_id": "nvidia_vss_warehouse_2d",
    "name": "NVIDIA VSS Warehouse 2D Vision AI Profile",
    "vendor": "nvidia",
    "source": "docs_blueprint",
    "category": "video_analytics",
    "short_description": "Single-camera warehouse analytics pipeline with RT-DETR, tracking and behavior analytics.",
    "supports_large_server_deployment": true,
    "reference_deployments": [
      {
        "deployment_id": "rtx6000pro_3x30fps",
        "hardware_label": "RTX6000pro + AMD EPYC 9124 16-Core",
        "hardware_class": "1gpu_or_edge_server",
        "gpu_topology": "single RTX6000pro",
        "workload_input": {
          "num_streams": 3,
          "fps": 30,
          "detector_model": "RT-DETR"
        },
        "performance": {
          "video_pipeline_p50_ms": 44,
          "behavior_pipeline_p50_ms": 33,
          "e2e_p50_ms": 77
        }
      },
      {
        "deployment_id": "dgx_spark_3x30fps",
        "hardware_label": "NVIDIA DGX Spark + ARM Cortex-X925/A725 20-Core",
        "hardware_class": "reference_appliance",
        "gpu_topology": "DGX Spark integrated",
        "workload_input": {
          "num_streams": 3,
          "fps": 30,
          "detector_model": "RT-DETR"
        },
        "performance": {
          "video_pipeline_p50_ms": 50,
          "behavior_pipeline_p50_ms": 32,
          "e2e_p50_ms": 82
        }
      },
      {
        "deployment_id": "igx_thor_3x30fps",
        "hardware_label": "NVIDIA IGX Thor + ARM 14-Core",
        "hardware_class": "industrial_edge_appliance",
        "gpu_topology": "IGX Thor integrated",
        "workload_input": {
          "num_streams": 3,
          "fps": 30,
          "detector_model": "RT-DETR"
        },
        "performance": {
          "video_pipeline_p50_ms": 89,
          "behavior_pipeline_p50_ms": 36,
          "e2e_p50_ms": 125
        }
      }
    ],
    "pipeline_roles": [
      {
        "role_id": "detector_role",
        "role_type": "vision_detector",
        "replaceable": true,
        "default_model_reference": "RT-DETR",
        "allowed_model_kinds": [
          "huggingface_vision_detector",
          "tao_export",
          "nim_cv"
        ],
        "language_sensitive": false,
        "notes": "Primary object detection stage."
      },
      {
        "role_id": "tracking_role",
        "role_type": "tracking_analytics",
        "replaceable": false,
        "default_model_reference": "behavior analytics pipeline",
        "allowed_model_kinds": [
          "service"
        ],
        "language_sensitive": false,
        "notes": "Tracking and rule-based analytics microservices."
      },
      {
        "role_id": "event_reasoning_role",
        "role_type": "optional_llm",
        "replaceable": true,
        "default_model_reference": "none",
        "allowed_model_kinds": [
          "huggingface_llm",
          "nim_llm",
          "api_llm"
        ],
        "language_sensitive": true,
        "notes": "Optional narrative/event explanation layer for localized outputs."
      }
    ],
    "supports_model_substitution": true,
    "substitution_policy": {
      "role_based": true,
      "hf_supported": true,
      "language_override_supported": true,
      "required_capabilities_by_role": {
        "detector_role": [
          "warehouse_or_equivalent_detection_domain",
          "real_time_throughput"
        ],
        "event_reasoning_role": [
          "multilingual_generation_if_enabled"
        ]
      },
      "risk_notes": [
        "Detector swaps change stream capacity directly.",
        "Hungarian requirements typically matter only for optional alert text or explanation stages, not the detector."
      ]
    },
    "simulation_tags": [
      "24x7",
      "realtime",
      "streaming",
      "video_detection",
      "batch_microbatch"
    ],
    "known_limitations": [
      "Latency varies with object count, ROIs, tripwires and machine load.",
      "Changing hardware or stream count requires coordinated config tuning."
    ],
    "source_urls": [
      "https://docs.nvidia.com/vss/latest/warehouse-docs/2D-profile.html",
      "https://docs.nvidia.com/vss/latest/models/rt-detr.html",
      "https://docs.nvidia.com/vss/3.1.0/prerequisites.html"
    ]
  },
  {
    "blueprint_id": "nvidia_vss_warehouse_2d_agents",
    "name": "NVIDIA VSS Warehouse 2D Vision AI with Agents Profile",
    "vendor": "nvidia",
    "source": "docs_blueprint",
    "category": "video_analytics",
    "short_description": "Warehouse 2D profile with RT-DETR plus agentic UI, chat and optional LLM/VLM layers.",
    "supports_large_server_deployment": true,
    "reference_deployments": [
      {
        "deployment_id": "dgx_spark_4x30fps_agents",
        "hardware_label": "NVIDIA DGX Spark + ARM Cortex-X925/A725 20-Core",
        "hardware_class": "reference_appliance",
        "gpu_topology": "DGX Spark integrated",
        "workload_input": {
          "num_streams": 4,
          "fps": 30,
          "detector_model": "RT-DETR"
        },
        "performance": {
          "video_pipeline_p50_ms": 56,
          "behavior_pipeline_p50_ms": 24,
          "e2e_p50_ms": 80
        }
      }
    ],
    "pipeline_roles": [
      {
        "role_id": "detector_role",
        "role_type": "vision_detector",
        "replaceable": true,
        "default_model_reference": "RT-DETR",